[
  {
    "index": 0,
    "left_cumulative": 0.0,
    "rate": 2.0,
    "step_size": 0.1,
    "time": 0.0,
    "trapezoid_absolute_error": 0.0,
    "trapezoid_cumulative": 0.0,
    "true_cumulative": 0.0,
    "warning": "Numerical integration depends on spacing, integration rule, data quality, boundary endpoints, and missing-value handling."
  },
  {
    "index": 1,
    "left_cumulative": 0.2,
    "rate": 2.1098334166468278,
    "step_size": 0.1,
    "time": 0.1,
    "trapezoid_absolute_error": 4.163889632868845e-06,
    "trapezoid_cumulative": 0.20549167083234138,
    "true_cumulative": 0.20549583472197425,
    "warning": "Numerical integration depends on spacing, integration rule, data quality, boundary endpoints, and missing-value handling."
  },
  {
    "index": 2,
    "left_cumulative": 0.4109833416646828,
    "rate": 2.2186693307950613,
    "step_size": 0.1,
    "time": 0.2,
    "trapezoid_absolute_error": 1.6613954322564073e-05,
    "trapezoid_cumulative": 0.42191680820443583,
    "true_cumulative": 0.4219334221587584,
    "warning": "Numerical integration depends on spacing, integration rule, data quality, boundary endpoints, and missing-value handling."
  },
  {
    "index": 3,
    "left_cumulative": 0.632850274744189,
    "rate": 2.325520206661339,
    "step_size": 0.1,
    "time": 0.30000000000000004,
    "trapezoid_absolute_error": 3.7225797138162875e-05,
    "trapezoid_cumulative": 0.6491262850772559,
    "true_cumulative": 0.6491635108743941,
    "warning": "Numerical integration depends on spacing, integration rule, data quality, boundary endpoints, and missing-value handling."
  },
  {
    "index": 4,
    "left_cumulative": 0.8654022954103229,
    "rate": 2.4294183423086504,
    "step_size": 0.1,
    "time": 0.4,
    "trapezoid_absolute_error": 6.579347135959868e-05,
    "trapezoid_cumulative": 0.8868732125257554,
    "true_cumulative": 0.886939005997115,
    "warning": "Numerical integration depends on spacing, integration rule, data quality, boundary endpoints, and missing-value handling."
  },
  {
    "index": 5,
    "left_cumulative": 1.108344129641188,
    "rate": 2.529425538604203,
    "step_size": 0.1,
    "time": 0.5,
    "trapezoid_absolute_error": 0.00010203153822918587,
    "trapezoid_cumulative": 1.134815406571398,
    "true_cumulative": 1.1349174381096272,
    "warning": "Numerical integration depends on spacing, integration rule, data quality, boundary endpoints, and missing-value handling."
  },
  {
    "index": 6,
    "left_cumulative": 1.3612866835016084,
    "rate": 2.6246424733950353,
    "step_size": 0.1,
    "time": 0.6000000000000001,
    "trapezoid_absolute_error": 0.00014557791896208094,
    "trapezoid_cumulative": 1.39251880717136,
    "true_cumulative": 1.392664385090322,
    "warning": "Numerical integration depends on spacing, integration rule, data quality, boundary endpoints, and missing-value handling."
  },
  {
    "index": 7,
    "left_cumulative": 1.623750930841112,
    "rate": 2.714217687237691,
    "step_size": 0.1,
    "time": 0.7000000000000001,
    "trapezoid_absolute_error": 0.0001959975125154223,
    "trapezoid_cumulative": 1.6594618152029963,
    "true_cumulative": 1.6596578127155117,
    "warning": "Numerical integration depends on spacing, integration rule, data quality, boundary endpoints, and missing-value handling."
  },
  {
    "index": 8,
    "left_cumulative": 1.8951726995648812,
    "rate": 2.7973560908995228,
    "step_size": 0.1,
    "time": 0.8,
    "trapezoid_absolute_error": 0.0002527865429777787,
    "trapezoid_cumulative": 1.935040504109857,
    "true_cumulative": 1.9352932906528348,
    "warning": "Numerical integration depends on spacing, integration rule, data quality, boundary endpoints, and missing-value handling."
  },
  {
    "index": 9,
    "left_cumulative": 2.1749083086548335,
    "rate": 2.873326909627483,
    "step_size": 0.1,
    "time": 0.9,
    "trapezoid_absolute_error": 0.0003153775931288294,
    "trapezoid_cumulative": 2.2185746541362072,
    "true_cumulative": 2.218890031729336,
    "warning": "Numerical integration depends on spacing, integration rule, data quality, boundary endpoints, and missing-value handling."
  },
  {
    "index": 10,
    "left_cumulative": 2.462240999617582,
    "rate": 2.941470984807897,
    "step_size": 0.1,
    "time": 1.0,
    "trapezoid_absolute_error": 0.0003831452738838337,
    "trapezoid_cumulative": 2.5093145488579762,
    "true_cumulative": 2.50969769413186,
    "warning": "Numerical integration depends on spacing, integration rule, data quality, boundary endpoints, and missing-value handling."
  },
  {
    "index": 11,
    "left_cumulative": 2.7563880980983715,
    "rate": 3.0012073600614353,
    "step_size": 0.1,
    "time": 1.1,
    "trapezoid_absolute_error": 0.00045541247298030996,
    "trapezoid_cumulative": 2.806448466101443,
    "true_cumulative": 2.806903878574423,
    "warning": "Numerical integration depends on spacing, integration rule, data quality, boundary endpoints, and missing-value handling."
  },
  {
    "index": 12,
    "left_cumulative": 3.0565088341045152,
    "rate": 3.0520390859672264,
    "step_size": 0.1,
    "time": 1.2000000000000002,
    "trapezoid_absolute_error": 0.0005314571204513285,
    "trapezoid_cumulative": 3.1091107884028757,
    "true_cumulative": 3.109642245523327,
    "warning": "Numerical integration depends on spacing, integration rule, data quality, boundary endpoints, and missing-value handling."
  },
  {
    "index": 13,
    "left_cumulative": 3.361712742701238,
    "rate": 3.093558185417193,
    "step_size": 0.1,
    "time": 1.3,
    "trapezoid_absolute_error": 0.0006105194033159123,
    "trapezoid_cumulative": 3.4163906519720966,
    "true_cumulative": 3.4170011713754125,
    "warning": "Numerical integration depends on spacing, integration rule, data quality, boundary endpoints, and missing-value handling."
  },
  {
    "index": 14,
    "left_cumulative": 3.6710685612429574,
    "rate": 3.1254497299884605,
    "step_size": 0.1,
    "time": 1.4000000000000001,
    "trapezoid_absolute_error": 0.0006918093573800022,
    "trapezoid_cumulative": 3.7273410477423794,
    "true_cumulative": 3.7280328570997594,
    "warning": "Numerical integration depends on spacing, integration rule, data quality, boundary endpoints, and missing-value handling."
  },
  {
    "index": 15,
    "left_cumulative": 3.9836135342418038,
    "rate": 3.1474949866040545,
    "step_size": 0.1,
    "time": 1.5,
    "trapezoid_absolute_error": 0.000774514760292,
    "trapezoid_cumulative": 4.0409882835720055,
    "true_cumulative": 4.0417627983322975,
    "warning": "Numerical integration depends on spacing, integration rule, data quality, boundary endpoints, and missing-value handling."
  },
  {
    "index": 16,
    "left_cumulative": 4.298363032902209,
    "rate": 3.159573603041505,
    "step_size": 0.1,
    "time": 1.6,
    "trapezoid_absolute_error": 0.0008578092470052923,
    "trapezoid_cumulative": 4.356341713054284,
    "true_cumulative": 4.357199522301289,
    "warning": "Numerical integration depends on spacing, integration rule, data quality, boundary endpoints, and missing-value handling."
  },
  {
    "index": 17,
    "left_cumulative": 4.614320393206359,
    "rate": 3.1616648104524687,
    "step_size": 0.1,
    "time": 1.7000000000000002,
    "trapezoid_absolute_error": 0.0009408605665424119,
    "trapezoid_cumulative": 4.672403633728982,
    "true_cumulative": 4.673344494295525,
    "warning": "Numerical integration depends on spacing, integration rule, data quality, boundary endpoints, and missing-value handling."
  },
  {
    "index": 18,
    "left_cumulative": 4.930486874251606,
    "rate": 3.1538476308781953,
    "step_size": 0.1,
    "time": 1.8,
    "trapezoid_absolute_error": 0.0010228388975717095,
    "trapezoid_cumulative": 4.988179255795515,
    "true_cumulative": 4.989202094693087,
    "warning": "Numerical integration depends on spacing, integration rule, data quality, boundary endpoints, and missing-value handling."
  },
  {
    "index": 19,
    "left_cumulative": 5.245871637339426,
    "rate": 3.1363000876874145,
    "step_size": 0.1,
    "time": 1.9000000000000001,
    "trapezoid_absolute_error": 0.0011029251397083328,
    "trapezoid_cumulative": 5.3026866417237954,
    "true_cumulative": 5.303789566863504,
    "warning": "Numerical integration depends on spacing, integration rule, data quality, boundary endpoints, and missing-value handling."
  },
  {
    "index": 20,
    "left_cumulative": 5.559501646108167,
    "rate": 3.109297426825682,
    "step_size": 0.1,
    "time": 2.0,
    "trapezoid_absolute_error": 0.0011803190976920064,
    "trapezoid_cumulative": 5.61496651744945,
    "true_cumulative": 5.616146836547142,
    "warning": "Numerical integration depends on spacing, integration rule, data quality, boundary endpoints, and missing-value handling."
  },
  {
    "index": 21,
    "left_cumulative": 5.870431388790736,
    "rate": 3.073209366648874,
    "step_size": 0.1,
    "time": 2.1,
    "trapezoid_absolute_error": 0.0012542474766794598,
    "trapezoid_cumulative": 5.924091857123178,
    "true_cumulative": 5.925346104599858,
    "warning": "Numerical integration depends on spacing, integration rule, data quality, boundary endpoints, and missing-value handling."
  },
  {
    "index": 22,
    "left_cumulative": 6.177752325455623,
    "rate": 3.0284964038195903,
    "step_size": 0.1,
    "time": 2.2,
    "trapezoid_absolute_error": 0.0013239716087447562,
    "trapezoid_cumulative": 6.229177145646601,
    "true_cumulative": 6.230501117255346,
    "warning": "Numerical integration depends on spacing, integration rule, data quality, boundary endpoints, and missing-value handling."
  },
  {
    "index": 23,
    "left_cumulative": 6.480601965837582,
    "rate": 2.97570521217672,
    "step_size": 0.1,
    "time": 2.3000000000000003,
    "trapezoid_absolute_error": 0.0013887948334083688,
    "trapezoid_cumulative": 6.529387226446417,